{
  "case_id": "MLA-BUG-002",
  "target_domain": "gpu",
  "target_path": "corpus/mla/reproducers/MLA_BUG_002_vllm_38439.py",
  "rail": "cute-mla",
  "class": "precision",
  "severity_estimate": "medium",
  "notes": "vLLM #38439 — NVFP4 + MLA error during processing. Reproducer guards on REQUIRED_CC=(10, 0). Oracle tolerance preset: nvfp4."
}
